{
  "$schema": "https://json-schema.org/draft/2020-12/schema",
  "$id": "https://github.com/munisp/blueeconomy-data-platform/schemas/event-envelope.schema.json",
  "title": "Blue Economy Platform Event Envelope",
  "description": "Canonical platform event envelope (blueeconomy.contracts.v1.EventEnvelope, JSON rendering) as emitted by every governed producer on the platform Kafka topics.",
  "type": "object",
  "additionalProperties": false,
  "required": [
    "envelopeVersion",
    "eventId",
    "eventType",
    "occurredAt",
    "producer",
    "correlationId",
    "fhir",
    "provenance",
    "classification"
  ],
  "properties": {
    "envelopeVersion": {
      "type": "string",
      "const": "1.0"
    },
    "eventId": {
      "type": "string",
      "format": "uuid"
    },
    "eventType": {
      "type": "string",
      "pattern": "^[a-z][a-z0-9_.-]{2,127}$"
    },
    "occurredAt": {
      "type": "string",
      "format": "date-time"
    },
    "producer": {
      "type": "string",
      "minLength": 1,
      "maxLength": 256
    },
    "correlationId": {
      "type": "string",
      "minLength": 1,
      "maxLength": 256
    },
    "fhir": {
      "type": "object",
      "description": "FHIR R4 message Bundle whose first entry carries the primary domain resource for the event.",
      "required": ["resourceType", "type", "entry"],
      "properties": {
        "resourceType": {
          "type": "string",
          "const": "Bundle"
        },
        "type": {
          "type": "string",
          "const": "message"
        },
        "entry": {
          "type": "array",
          "minItems": 1,
          "items": {
            "type": "object",
            "required": ["resource"],
            "properties": {
              "resource": {
                "type": "object"
              }
            }
          }
        }
      }
    },
    "provenance": {
      "type": "object",
      "additionalProperties": false,
      "required": ["principalId", "principalRole", "signature", "ledgerCommitHash"],
      "properties": {
        "principalId": {
          "type": "string",
          "minLength": 1,
          "maxLength": 256
        },
        "principalRole": {
          "type": "string",
          "minLength": 1,
          "maxLength": 128
        },
        "signature": {
          "type": "string",
          "minLength": 1,
          "maxLength": 512
        },
        "ledgerCommitHash": {
          "type": "string",
          "minLength": 1,
          "maxLength": 512
        }
      }
    },
    "classification": {
      "type": "string",
      "enum": [
        "FIDUCIARY_SEGREGATED",
        "CONFIDENTIAL",
        "RESTRICTED",
        "INTERNAL",
        "PUBLIC"
      ]
    },
    "recordClassification": {
      "type": "string",
      "description": "Optional per-record clearance label persisted as a column for row-level filtering; mandatory for isr scope records.",
      "enum": [
        "UNCLASSIFIED",
        "RESTRICTED",
        "CONFIDENTIAL",
        "SECRET"
      ]
    }
  }
}
