{
  "envelopeVersion": "1.0",
  "eventId": "3f6b2a1e-9c4d-4e8a-b7f1-2d5c8a0e6b41",
  "eventType": "ferries.ticketing.ticket.v1",
  "occurredAt": "2026-08-12T12:00:00Z",
  "producer": "ferry-ticketing",
  "correlationId": "3f6b2a1e-9c4d-4e8a-b7f1-2d5c8a0e6b41",
  "fhir": {
    "resourceType": "Bundle",
    "type": "message",
    "entry": [
      {
        "resource": {
          "resourceType": "Basic",
          "internalEventType": "ferry.ticket.issued",
          "subjectId": "ticket-2026-000184",
          "ticket_id": "ticket-2026-000184",
          "route_id": "lagos-calabar-07",
          "fare_amount": "4500.00",
          "currency": "NGN",
          "principal_id": "svc-ferry-ticketing",
          "principal_role": "ticketing-agent",
          "state": "issued",
          "ledger_transfer_id": "9d1c7f2ab34e56c8901de4f6a2b3c4d5e6f708192a3b4c5d6e7f8091a2b3c4d5"
        }
      }
    ]
  },
  "provenance": {
    "principalId": "svc-ferry-ticketing",
    "principalRole": "ticketing-agent",
    "signature": "eyJhbGciOiJFZERTQSIsImtpZCI6ImZlcnJ5LXRpY2tldGluZy0wIn0.eyJjbGFzc2lmaWNhdGlvbiI6IklOVEVSTkFMIiwiY29ycmVsYXRpb25JZCI6IjNmNmIyYTFlLTljNGQtNGU4YS1iN2YxLTJkNWM4YTBlNmI0MSIsImVudmVsb3BlVmVyc2lvbiI6IjEuMCIsImV2ZW50SWQiOiIzZjZiMmExZS05YzRkLTRlOGEtYjdmMS0yZDVjOGEwZTZiNDEiLCJldmVudFR5cGUiOiJmZXJyaWVzLnRpY2tldGluZy50aWNrZXQudjEiLCJmaGlyIjp7ImVudHJ5IjpbeyJyZXNvdXJjZSI6eyJjdXJyZW5jeSI6Ik5HTiIsImZhcmVfYW1vdW50IjoiNDUwMC4wMCIsImludGVybmFsRXZlbnRUeXBlIjoiZmVycnkudGlja2V0Lmlzc3VlZCIsImxlZGdlcl90cmFuc2Zlcl9pZCI6IjlkMWM3ZjJhYjM0ZTU2Yzg5MDFkZTRmNmEyYjNjNGQ1ZTZmNzA4MTkyYTNiNGM1ZDZlN2Y4MDkxYTJiM2M0ZDUiLCJwcmluY2lwYWxfaWQiOiJzdmMtZmVycnktdGlja2V0aW5nIiwicHJpbmNpcGFsX3JvbGUiOiJ0aWNrZXRpbmctYWdlbnQiLCJyZXNvdXJjZVR5cGUiOiJCYXNpYyIsInJvdXRlX2lkIjoibGFnb3MtY2FsYWJhci0wNyIsInN0YXRlIjoiaXNzdWVkIiwic3ViamVjdElkIjoidGlja2V0LTIwMjYtMDAwMTg0IiwidGlja2V0X2lkIjoidGlja2V0LTIwMjYtMDAwMTg0In19XSwicmVzb3VyY2VUeXBlIjoiQnVuZGxlIiwidHlwZSI6Im1lc3NhZ2UifSwib2NjdXJyZWRBdCI6IjIwMjYtMDgtMTJUMTI6MDA6MDBaIiwicHJvZHVjZXIiOiJmZXJyeS10aWNrZXRpbmciLCJwcm92ZW5hbmNlIjp7ImxlZGdlckNvbW1pdEhhc2giOiI5ZDFjN2YyYWIzNGU1NmM4OTAxZGU0ZjZhMmIzYzRkNWU2ZjcwODE5MmEzYjRjNWQ2ZTdmODA5MWEyYjNjNGQ1IiwicHJpbmNpcGFsSWQiOiJzdmMtZmVycnktdGlja2V0aW5nIiwicHJpbmNpcGFsUm9sZSI6InRpY2tldGluZy1hZ2VudCJ9fQ.ShY-LJX5DzGe1ZYqOapxIB-_68CZ2xMxBFF7ikpl60un7H9tAQUul_HUhH034dQcRoDsScmnelJ8Bayrt85fAg",
    "ledgerCommitHash": "9d1c7f2ab34e56c8901de4f6a2b3c4d5e6f708192a3b4c5d6e7f8091a2b3c4d5"
  },
  "classification": "INTERNAL"
}
