{
  "envelopeVersion": "1.0",
  "eventId": "e1f2a3b4-c5d6-4e7f-8091-a2b3c4d5e6f7",
  "eventType": "seafarer.credential.v1",
  "occurredAt": "2026-08-12T12:20:00Z",
  "producer": "credential-verification",
  "correlationId": "corr-seafarer-credential-00213",
  "fhir": {
    "resourceType": "Bundle",
    "type": "message",
    "timestamp": "2026-08-12T12:20:00Z",
    "entry": [
      {
        "fullUrl": "urn:uuid:e1f2a3b4-c5d6-4e7f-8091-a2b3c4d5e6f7",
        "resource": {
          "resourceType": "Basic",
          "id": "seafarer-credential-00213",
          "credential_id": "seafarer-credential-00213",
          "credential_type": "STCW-II/1",
          "holder_reference": "seafarer-registry-ref-00981",
          "status": "issued"
        }
      }
    ]
  },
  "provenance": {
    "principalId": "svc-credential-verification",
    "principalRole": "seafarer-registry",
    "signature": "eyJhbGciOiJFZERTQSIsImtpZCI6ImNyZWRlbnRpYWwtdmVyaWZpY2F0aW9uLTAifQ.eyJjbGFzc2lmaWNhdGlvbiI6IkNPTkZJREVOVElBTCIsImNvcnJlbGF0aW9uSWQiOiJjb3JyLXNlYWZhcmVyLWNyZWRlbnRpYWwtMDAyMTMiLCJlbnZlbG9wZVZlcnNpb24iOiIxLjAiLCJldmVudElkIjoiZTFmMmEzYjQtYzVkNi00ZTdmLTgwOTEtYTJiM2M0ZDVlNmY3IiwiZXZlbnRUeXBlIjoic2VhZmFyZXIuY3JlZGVudGlhbC52MSIsImZoaXIiOnsiZW50cnkiOlt7ImZ1bGxVcmwiOiJ1cm46dXVpZDplMWYyYTNiNC1jNWQ2LTRlN2YtODA5MS1hMmIzYzRkNWU2ZjciLCJyZXNvdXJjZSI6eyJjcmVkZW50aWFsX2lkIjoic2VhZmFyZXItY3JlZGVudGlhbC0wMDIxMyIsImNyZWRlbnRpYWxfdHlwZSI6IlNUQ1ctSUkvMSIsImhvbGRlcl9yZWZlcmVuY2UiOiJzZWFmYXJlci1yZWdpc3RyeS1yZWYtMDA5ODEiLCJpZCI6InNlYWZhcmVyLWNyZWRlbnRpYWwtMDAyMTMiLCJyZXNvdXJjZVR5cGUiOiJCYXNpYyIsInN0YXR1cyI6Imlzc3VlZCJ9fV0sInJlc291cmNlVHlwZSI6IkJ1bmRsZSIsInRpbWVzdGFtcCI6IjIwMjYtMDgtMTJUMTI6MjA6MDBaIiwidHlwZSI6Im1lc3NhZ2UifSwib2NjdXJyZWRBdCI6IjIwMjYtMDgtMTJUMTI6MjA6MDBaIiwicHJvZHVjZXIiOiJjcmVkZW50aWFsLXZlcmlmaWNhdGlvbiIsInByb3ZlbmFuY2UiOnsibGVkZ2VyQ29tbWl0SGFzaCI6IjNiNGM1ZDZlN2Y4MDkxYTJiM2M0ZDVlNmY3MDgxOTEyMmEzYjRjNWQ2ZTdmODA5MWEyYjNjNGQ1ZTZmNzA4MTkiLCJwcmluY2lwYWxJZCI6InN2Yy1jcmVkZW50aWFsLXZlcmlmaWNhdGlvbiIsInByaW5jaXBhbFJvbGUiOiJzZWFmYXJlci1yZWdpc3RyeSJ9fQ.o8UzUZThBLsjYwQqRO5TamKGWPWmEbP_JSd3Syj-UVoGZdHNN5ZXkDpQuQxEqudSVrQ0gcseDOUoywtQdxfoCQ",
    "ledgerCommitHash": "3b4c5d6e7f8091a2b3c4d5e6f70819122a3b4c5d6e7f8091a2b3c4d5e6f70819"
  },
  "classification": "CONFIDENTIAL"
}
