{
  "envelopeVersion": "1.0",
  "eventId": "7a1d4c2e-5b8f-4a09-9e3c-1f6b8d0a2c55",
  "eventType": "cvff.disbursement.v1",
  "occurredAt": "2026-08-12T12:05:00Z",
  "producer": "financial-controls",
  "correlationId": "7a1d4c2e-5b8f-4a09-9e3c-1f6b8d0a2c55",
  "fhir": {
    "resourceType": "Bundle",
    "type": "message",
    "entry": [
      {
        "resource": {
          "resourceType": "Basic",
          "internalEventType": "cvff.disbursed",
          "subjectId": "cvff-application-00042",
          "application_id": "cvff-application-00042",
          "intent_id": "a4b6c8d0e2f40618293a4b5c6d7e8f90a1b2c3d4e5f60718293a4b5c6d7e8f90",
          "amount": "1250000.00",
          "currency": "NGN",
          "maker": "svc-financial-controls",
          "role": "disbursement-approver",
          "state": "disbursed"
        }
      }
    ]
  },
  "provenance": {
    "principalId": "svc-financial-controls",
    "principalRole": "disbursement-approver",
    "signature": "1b2c3d4e5f60718293a4b5c6d7e8f90a1b2c3d4e5f60718293a4b5c6d7e8f90a4b",
    "ledgerCommitHash": "a4b6c8d0e2f40618293a4b5c6d7e8f90a1b2c3d4e5f60718293a4b5c6d7e8f90"
  },
  "classification": "FIDUCIARY_SEGREGATED"
}
